{
  "defaults": {
    "project": "C:/work/Game",
    "unity": "C:/Program Files/Unity/Hub/Editor/2022.3.45f1/Editor/Unity.exe",
    "wait": true,
    "timeoutMs": 600000,
    "waitTimeoutMs": 600000,
    "env": {
      "UNITY_CLI_BRIDGE_ENDPOINT": "http://127.0.0.1:18080"
    }
  },
  "envAllowlist": ["UNITY_CLI_BRIDGE_ENDPOINT"],
  "failFast": true,
  "parallel": 4,
  "steps": [
    {
      "id": "read-console",
      "command": ["tools", "run", "editor.console"]
    },
    {
      "id": "list-cameras",
      "command": ["tools", "run", "camera.list"]
    },
    {
      "id": "camera-info",
      "command": ["tools", "run", "camera.info"],
      "args": ["--input", "{\"target\":\"Main Camera\"}"]
    },
    {
      "id": "editor-state",
      "command": ["tools", "run", "editor.state"]
    }
  ]
}
